[
  {
    "card_id": "charizard_base_holo_001",
    "card_name": "Charizard Base Set Holo",
    "predicted_grade": 9.2,
    "final_grade": 9,
    "roi_decision": "STRONG GRADE",
    "actual_outcome_profit": 480,
    "predicted_profit": 510,
    "profile": "pokemon_vintage",
    "timestamp": "2025-09-15T10:22:00Z",
    "notes": "Slight surface scratch missed — predicted surface score too optimistic"
  },
  {
    "card_id": "blastoise_base_holo_001",
    "card_name": "Blastoise Base Set Holo",
    "predicted_grade": 8.7,
    "final_grade": 8,
    "roi_decision": "GRADE",
    "actual_outcome_profit": 55,
    "predicted_profit": 90,
    "profile": "pokemon_vintage",
    "timestamp": "2025-09-15T10:35:00Z",
    "notes": "Corner whitening underestimated — system was 0.5 too optimistic"
  },
  {
    "card_id": "venusaur_base_holo_001",
    "card_name": "Venusaur Base Set Holo",
    "predicted_grade": 7.5,
    "final_grade": 7,
    "roi_decision": "CONDITIONAL",
    "actual_outcome_profit": 12,
    "predicted_profit": 25,
    "profile": "pokemon_vintage",
    "timestamp": "2025-09-16T09:10:00Z",
    "notes": null
  },
  {
    "card_id": "pikachu_yellow_cheeks_001",
    "card_name": "Pikachu Yellow Cheeks Base Set",
    "predicted_grade": 9.5,
    "final_grade": 10,
    "roi_decision": "STRONG GRADE",
    "actual_outcome_profit": 620,
    "predicted_profit": 580,
    "profile": "pokemon_vintage",
    "timestamp": "2025-09-16T11:00:00Z",
    "notes": "System under-graded — PSA was more lenient on centering"
  },
  {
    "card_id": "mewtwo_base_holo_001",
    "card_name": "Mewtwo Base Set Holo",
    "predicted_grade": 6.2,
    "final_grade": 6,
    "roi_decision": "DO NOT GRADE",
    "actual_outcome_profit": null,
    "predicted_profit": -15,
    "profile": "pokemon_vintage",
    "timestamp": "2025-09-17T14:00:00Z",
    "notes": "Correct DO NOT GRADE call — heavy edge wear confirmed"
  },
  {
    "card_id": "umbreon_neo_discovery_001",
    "card_name": "Umbreon Neo Discovery Holo",
    "predicted_grade": 9.0,
    "final_grade": 9,
    "roi_decision": "STRONG GRADE",
    "actual_outcome_profit": 210,
    "predicted_profit": 195,
    "profile": "pokemon_vintage",
    "timestamp": "2025-09-18T08:30:00Z",
    "notes": null
  },
  {
    "card_id": "espeon_neo_discovery_001",
    "card_name": "Espeon Neo Discovery Holo",
    "predicted_grade": 8.5,
    "final_grade": 9,
    "roi_decision": "GRADE",
    "actual_outcome_profit": 175,
    "predicted_profit": 130,
    "profile": "pokemon_vintage",
    "timestamp": "2025-09-18T09:00:00Z",
    "notes": "System under-graded by 0.5 — actual outcome was better than predicted"
  },
  {
    "card_id": "rayquaza_ex_delta_001",
    "card_name": "Rayquaza EX Delta Species",
    "predicted_grade": 9.2,
    "final_grade": 8,
    "roi_decision": "GRADE",
    "actual_outcome_profit": -18,
    "predicted_profit": 85,
    "profile": "pokemon_vintage",
    "timestamp": "2025-09-19T13:15:00Z",
    "notes": "False positive GRADE — print line on surface caused PSA to drop to 8. System missed it."
  },
  {
    "card_id": "charizard_ex_firered_001",
    "card_name": "Charizard EX FireRed LeafGreen",
    "predicted_grade": 9.0,
    "final_grade": 9,
    "roi_decision": "STRONG GRADE",
    "actual_outcome_profit": 320,
    "predicted_profit": 310,
    "profile": "pokemon_vintage",
    "timestamp": "2025-09-20T10:00:00Z",
    "notes": null
  },
  {
    "card_id": "lugia_neo_genesis_001",
    "card_name": "Lugia Neo Genesis Holo",
    "predicted_grade": 9.5,
    "final_grade": 9,
    "roi_decision": "STRONG GRADE",
    "actual_outcome_profit": 890,
    "predicted_profit": 950,
    "profile": "pokemon_vintage",
    "timestamp": "2025-09-20T14:30:00Z",
    "notes": "Grade 0.5 over-predicted — still very profitable, correct GRADE call"
  },
  {
    "card_id": "ho-oh_neo_revelation_001",
    "card_name": "Ho-Oh Neo Revelation Holo",
    "predicted_grade": 8.0,
    "final_grade": 7,
    "roi_decision": "CONDITIONAL",
    "actual_outcome_profit": -8,
    "predicted_profit": 30,
    "profile": "pokemon_vintage",
    "timestamp": "2025-09-21T09:45:00Z",
    "notes": "Centering worse than predicted — slight loss after fees"
  },
  {
    "card_id": "gengar_fossil_holo_001",
    "card_name": "Gengar Fossil Set Holo",
    "predicted_grade": 7.0,
    "final_grade": 7,
    "roi_decision": "CONDITIONAL",
    "actual_outcome_profit": 22,
    "predicted_profit": 18,
    "profile": "pokemon_vintage",
    "timestamp": "2025-09-22T11:20:00Z",
    "notes": null
  },
  {
    "card_id": "magneton_fossil_holo_001",
    "card_name": "Magneton Fossil Holo",
    "predicted_grade": 5.5,
    "final_grade": 5,
    "roi_decision": "DO NOT GRADE",
    "actual_outcome_profit": null,
    "predicted_profit": -20,
    "profile": "pokemon_vintage",
    "timestamp": "2025-09-23T15:00:00Z",
    "notes": "Correctly identified as not worth grading"
  },
  {
    "card_id": "pikachu_swsh_promo_001",
    "card_name": "Pikachu SWSH Promo 001",
    "predicted_grade": 9.5,
    "final_grade": 10,
    "roi_decision": "STRONG GRADE",
    "actual_outcome_profit": 45,
    "predicted_profit": 40,
    "profile": "pokemon_modern",
    "timestamp": "2025-09-24T10:00:00Z",
    "notes": "Near-perfect card — system correctly identified"
  },
  {
    "card_id": "charizard_vmax_swsh_001",
    "card_name": "Charizard VMAX SWSH Champions Path",
    "predicted_grade": 9.0,
    "final_grade": 9,
    "roi_decision": "STRONG GRADE",
    "actual_outcome_profit": 185,
    "predicted_profit": 170,
    "profile": "pokemon_modern",
    "timestamp": "2025-09-24T11:30:00Z",
    "notes": null
  },
  {
    "card_id": "umbreon_vmax_alt_001",
    "card_name": "Umbreon VMAX Alternate Art",
    "predicted_grade": 9.2,
    "final_grade": 9,
    "roi_decision": "STRONG GRADE",
    "actual_outcome_profit": 520,
    "predicted_profit": 490,
    "profile": "pokemon_modern",
    "timestamp": "2025-09-25T08:00:00Z",
    "notes": null
  },
  {
    "card_id": "rayquaza_vmax_alt_001",
    "card_name": "Rayquaza VMAX Alternate Art",
    "predicted_grade": 8.5,
    "final_grade": 8,
    "roi_decision": "GRADE",
    "actual_outcome_profit": 60,
    "predicted_profit": 80,
    "profile": "pokemon_modern",
    "timestamp": "2025-09-25T09:00:00Z",
    "notes": "Centering slightly worse than expected"
  },
  {
    "card_id": "giratina_vstar_alt_001",
    "card_name": "Giratina VSTAR Alternate Art",
    "predicted_grade": 9.5,
    "final_grade": 9,
    "roi_decision": "STRONG GRADE",
    "actual_outcome_profit": 240,
    "predicted_profit": 270,
    "profile": "pokemon_modern",
    "timestamp": "2025-09-26T13:00:00Z",
    "notes": "Slight over-prediction on corners"
  },
  {
    "card_id": "pikachu_illustrator_reprint_001",
    "card_name": "Pikachu Illustrator Promo (Reprint)",
    "predicted_grade": 6.0,
    "final_grade": 6,
    "roi_decision": "HOLD RAW",
    "actual_outcome_profit": 0,
    "predicted_profit": 5,
    "profile": "tcg_generic",
    "timestamp": "2025-09-27T10:30:00Z",
    "notes": "Correctly held raw — grading fees not justified"
  },
  {
    "card_id": "sylveon_vmax_alt_001",
    "card_name": "Sylveon VMAX Alternate Art",
    "predicted_grade": 9.0,
    "final_grade": 8,
    "roi_decision": "GRADE",
    "actual_outcome_profit": 25,
    "predicted_profit": 120,
    "profile": "pokemon_modern",
    "timestamp": "2025-09-28T09:15:00Z",
    "notes": "False positive — corner wear more severe than detected"
  },
  {
    "card_id": "arceus_vstar_alt_001",
    "card_name": "Arceus VSTAR Alternate Art",
    "predicted_grade": 9.5,
    "final_grade": 10,
    "roi_decision": "STRONG GRADE",
    "actual_outcome_profit": 310,
    "predicted_profit": 285,
    "profile": "pokemon_modern",
    "timestamp": "2025-09-29T14:00:00Z",
    "notes": "System slightly under-graded — PSA was more lenient"
  },
  {
    "card_id": "darkrai_vstar_001",
    "card_name": "Darkrai VSTAR Secret Rare",
    "predicted_grade": 7.5,
    "final_grade": 7,
    "roi_decision": "CONDITIONAL",
    "actual_outcome_profit": 8,
    "predicted_profit": 15,
    "profile": "pokemon_modern",
    "timestamp": "2025-09-30T10:00:00Z",
    "notes": null
  },
  {
    "card_id": "mew_swsh_promo_001",
    "card_name": "Mew SWSH Promo 078",
    "predicted_grade": 9.0,
    "final_grade": 9,
    "roi_decision": "GRADE",
    "actual_outcome_profit": 18,
    "predicted_profit": 20,
    "profile": "pokemon_modern",
    "timestamp": "2025-10-01T08:45:00Z",
    "notes": null
  },
  {
    "card_id": "bidoof_swsh_001",
    "card_name": "Bidoof SWSH Common",
    "predicted_grade": 5.0,
    "final_grade": 5,
    "roi_decision": "DO NOT GRADE",
    "actual_outcome_profit": null,
    "predicted_profit": -18,
    "profile": "pokemon_modern",
    "timestamp": "2025-10-01T09:00:00Z",
    "notes": "Correctly flagged as not worth grading"
  },
  {
    "card_id": "charizard_sv_obsidian_001",
    "card_name": "Charizard ex SV Obsidian Flames",
    "predicted_grade": 9.2,
    "final_grade": 9,
    "roi_decision": "STRONG GRADE",
    "actual_outcome_profit": 95,
    "predicted_profit": 100,
    "profile": "pokemon_modern",
    "timestamp": "2025-10-02T11:00:00Z",
    "notes": null
  }
]
